{
  "report_type": "coc-report",
  "po": "PO-AER-5519",
  "customer": "Aerodyne Systems",
  "part": "KC-1001",
  "heat": 4471,
  "cert_req": "COC-AER-001",
  "status": "incomplete",
  "items": [
    {
      "type": "chemistry-cert",
      "expected_path": "docs/heat-lots/HT-4471/chemistry-cert-HT-4471.md",
      "on_file": true,
      "sha256": "c3e4dd35c12355d4ebada68e55e6b4b1b3b555bdf4a3074e3669d92aed648681",
      "integrity": "ok"
    },
    {
      "type": "mechanical-test",
      "expected_path": "docs/heat-lots/HT-4471/mechanical-test-HT-4471.md",
      "on_file": false,
      "sha256": null,
      "integrity": "missing"
    },
    {
      "type": "heat-treat-cert",
      "expected_path": "docs/heat-lots/HT-4471/heat-treat-cert-HT-4471.md",
      "on_file": true,
      "sha256": "6fff4d244ef6b41f30364c418b3bf259b6a696c546f2d58876938533d34335fc",
      "integrity": "ok"
    },
    {
      "type": "dimensional-report",
      "expected_path": "docs/heat-lots/HT-4471/dimensional-report-HT-4471.md",
      "on_file": true,
      "sha256": "cba5b9a31d55a0a6156997aa0c6c90d6b549e93d78882e4b39b159d61e14bdc6",
      "integrity": "ok"
    },
    {
      "type": "traceability-statement",
      "expected_path": "docs/quality/cert-packages/PO-AER-5519/traceability-statement.md",
      "on_file": true,
      "sha256": "70e7a3563e1dabe708035ac4e9f02e981d62c9e22d9b992f878d3583cf5e04a7",
      "integrity": "ok"
    }
  ],
  "missing_records": [
    "mechanical-test"
  ],
  "verifier": {
    "tool": "scripts/verify-completeness.mjs",
    "exit_code": 3,
    "checked_at": "2026-08-06"
  },
  "summary": "Cert package REFUSED: heat HT-4471 has no mechanical (tensile) test report on file, so 1 of 5 records required by COC-AER-001 is missing. Do not issue a COC for PO-AER-5519 until the tensile report for HT-4471 is on file and hash-verified."
}
